lipids	 fats, and waxes
pericyclic reactions	 usually rearrangement reactions
pericyclic reactions	have similar reactions that are metal-catalyzed
barium compounds	 quite heavy
barium compounds	 colorless
decimals	 possible for fractions of day
decimals	 possible for fractions of hour
glands	make hormones
hares	 very fast-running animals
cold deserts	 covered with snow or ice
cold deserts	have a short season of above-freezing temperatures
bristle worms	have poison bristles
cytologists	label chromosomes with numbers
adaptations	help organisms survive in their ecological niches
cylindrical ones	 called carbon nanotubes or buckytubes
healthy gums	fill and fit each space between teeth
earth	has several processes for changing rocks
earth	has one moon
earth	 both cold and dry
earth	 planet
wooden spoons	 used for mixing food
tobacco pipes	 used to smoke tobacco
parasitic wasps	 extremely varied in their habits
plasma membranes	 very small
tiger beetles	 predators
mechanical waves	 a local oscillation of material
organic synthesis	 special type of chemical synthesis
twin primes	 prime numbers that differ by two
mercury	can cause both chronic and acute poisoning
antimony sulfide	 used in matches
adjuvants	usually boost immune response
skeletal muscles	 the only 'voluntary' muscles
different organisms	have cyst walls made of different things
palm trees	use water to disperse their coconuts
gold	 used in jewelry
poisons	can bleach and kill corals
flu viruses	 caught from animals
saltwater crocodiles	can go a long time without eating
saltwater crocodiles	 now a protected species in australia
paper	 used for writing and printing
paper	 made from wood fibres
limestone	 used to make glass and cement
ecology	 the study of ecosystems
ecology	 field of science
orcas	have mostly black skin with white patches
negative ions	 called 'anions'
babies	 born about five weeks after mating.
bearded seals	give birth in the spring
cancer	can also grow from the liver
cancer	can affect anybody at any age
cancer	 small and the stars are dim
male birds	have splendid feathers for attracting females
gazelles	 known as fast animals
element	contains only one kind of atom
swine flu	 common in pigs
orioles	have bright colored feathers
parasites	have complex life-cycles
tarantulas	can make silk
cocaine	 used as an illegal drug
cocaine	 very addictive drug
bronze	 made from copper and tin
bronze	 stronger than copper or tin alone
bronze	lasts longer than copper
scientific instruments	 objects used in science
graphic novels	 books of comics
starches	 insoluble in water
dragons	have caves
dragons	can also recognize individual humans
heart muscle	can even die if blood flow stops
organotin compounds	 toxic, though
tincture of iodine	 common iodine disinfectant
quarks	 held together by gluons
quarks	 elementary particles
quarks	 grouped into three pairs
pituitary adenomas	 microadenomas
animal life	 found on all levels
pumpkins	 spheres or stretched-out spheres
nuclear medicine	uses radiation for the treatment of illnesses
fancy rats	 domesticated brown rats
force	consists of magnetic force and electric force
force	 mass times acceleration
gnomes	 elemental spirits of earth
vectors	 used to show distances and directions
cartographers	 people who make maps
kingfishers	eat lizards or other reptiles
kingfishers	 found all over the world
kingfishers	eat fish
matter	 formed of atoms
mangroves	live right in the water
dioxins	cause cancer
psychological disorders	can contribute to vampiric behavior
freshwater crabs	show different behaviour than other crabs
freshwater crabs	 endemic to small areas
lactose	inhibits the repressor
amomum pods	 larger and dark brown
winter	begins around the winter solstice
winter	comes after autumn and is before spring
impulse turbines	change the velocity of a water jet
thongs	 a type of rubber footwear
moons	 natural satellites
berries	 small, sweet, liquid, bright colored fruits.
peanuts	 known scientifically as arachis hypogaea
caecilian eyes	 small and dark
verdins	 insectivores
iron ore	 basically iron oxide
stress	can also sometimes cause ulcers
wind	can move land, especially in deserts
wind	can also make valleys larger by erosion
lime juice	 used in cooking and in drinks
microscopic algae	 in lichens
digital clocks	use numbers to show the time
cylindric sections	 the intersections of cylinders with planes
molds	cause disease or food spoilage
hepatocellular carcinoma	 from cirrhosis
physical accidents	 things like collisions, injuries, and falling
macaques	 found in japan
macaques	 a model organism for studying neurology
mantids	 notable for their hunting abilities
various gases	exist in outer space
squirrels	have many predators or enemies
squirrels	belong in another family
different liquids	evaporate at different temperatures
communication	 how people share information
communication	works by exchanging information or messages
lentils	have a distinctive earthy flavor
mandrills	 predominantly terrestrial
red hair	 made by genes
lexemes	have several stems but one lemma
electrogenic fish	 electroreceptive
azo dye	 usually dark blue or blue-ish silver
muscle tissue	needs more energy than fatty tissue
periodic acid	 found as a colorless solution
red cinnabar	 used for the pigment vermilion
music	 whatever people think is music
music	 often important in religious celebrations
marmots	make holes in the ground
marmots	 very social animals
antelope	 sexually dimorphic
islamic art	includes geometric patterns, islamic calligraphy, and architecture
nouns	 things
cigarette smoking	causes most lung cancers
cigarette smoking	 the most important source of cadmium
developmental psychology	 the study of human psychological development
gluons	 have color charge
pizza	 food based on bread
pizza	 cooked in a oven
power	 energy per unit time
power	can mean electrical power
aerotolerant organisms	 strictly fermentative
waders	live in wetland or coastal environments
wild carrots	grow naturally in eurasia
socialism	 placed in between capitalism and communism
manganese dust	can irritate lungs
boats	move on the surface of the sea
rivers	flow underground through caves
rivers	overflowing can destroy houses and drown people
rivers	start in kashmir
ornithomimids	 a sister group to the troodontids
hadrons	 simply particles made of quarks
pines	live in almost the entire northern hemisphere
gas balloons	carry people
severe dengue	causes fluid to leak from the bloodstream
caracals	live in africa and west asia
caracals	 the fastest of the small cats
cosmology	 type of theoretical astrophysics
genetic drift	can be important in small populations
hot fluorine	makes bromine pentafluoride
nitrogen fixation	 done by micro-organisms called bacteria
maladaptive abnormalities	 can cause suffering and social discomfort.
male moose	have large antlers
psychologists	study the human mind and behavior
abdominal migraine	causes severe pain in the 'abdomen,'
abdominal migraines	can cause many different symptoms
waves	 found everywhere in the natural world
waves	 everywhere in the natural world
waves	 very important in the natural world
waves	 carry away small pieces of material
waves	have properties that can be measured
thunderstorms	 very active electrically
platypuses	can be big or small
platypus	 difficult to see in the wild
sensors	 used in everyday objects
pimples	often happen during adolescence or puberty
homosexual behaviour	 widespread among animals
binary information	 used for computer storage
scallops	have a central adductor muscle
scallops	live in all of the world's oceans
scallops	often contain sand when fishermen use dredges
abelian groups	 modules over the ring of integers
euphoria	can be a symptom of hyperthyroidism
bacteriology	 division of microbiology
zoos	have zookeepers and underkeepers
zoos	have aviaries
oak trees	lose all of their leaves in autumn
flash memory	 type of computer chip
scientists	call sugars carbohydrates
scientists	call making sperm 'spermatogenesis'
scientists	can work in different areas of science
scientists	divide the mosses into eight groups
scientists	use the scientific method for their research
nightmares	 dreams which scare or shock people
nightmares	usually happen during rem sleep
computer programs	 designed or written by computer programmers
computer programs	use icons on 'buttons'
vaccinations	do have some side effects
modern computers	 electronic machines
stained glass	 used in some kinds of art
sodium metal	 reacted with it
woodwind instruments	 played in a variety of ways
woodwind instruments	have several different embouchures
spoken languages	have no written form
spoken language	can have different rules than written language
spoken language	 much richer than written language
digital cameras	allow people to take pictures
digital cameras	can serve as video cameras
anthropology	 field of science
lions	live in groups that are called prides
feral animals	compete for food with domestic livestock
domestic animals	can breed with native, wild animals
diamonds	 the hardest natural mineral
systemic arterioles	turn into capillaries
biomedical engineers	design and work with medical equipment
yellow arsenic	 unstable and rare
pornography	 made to entertain adults
artificial satellites	 smaller, unmanned spacecraft
pugs	can get overweight
complete combustion	happens in a plentiful supply of air
complete combustion	releases more energy than incomplete combustion
catalysts	 either of natural or synthetic origin
new stars	change hydrogen to helium through nuclear fusion
pediatricians	take care of diseases that children get
jewelry	often uses gemstones and precious metals
materials	have a unique chemical attraction for electrons
materials	 'semiconductors'
ice creams	contain fruits
soy yoghurt	 made from soy milk
apes	 the descendants of old world monkeys
biologists	study living organisms
flea beetles	 an example of jumping beetle
infancy	lso a time of brain development
swallows	like to nest near other swallows
roots	go very deep into the ground
ballroom dances	 forms of modern dance
logic	 the mechanics of thought and analysis
logic	 used in mathematics
thalassemia	increases red cell flexibility
cacti	live in dry places, such as deserts
junipers	grow in the northern hemisphere
junipers	 evergreen
droughts	 a long time with no rain
abstract art	 found in painting and in sculpture
canals	usually connect lakes, rivers, or oceans
amines	 used a lot in chemistry
prairie dogs	use different calls to identify specific predators
funk music	 dance music
funk music	emphasizes the rhythm of the music
color blindness	 very sensitive to changes in material
toothpastes	can also come in many different flavours
tobacco smoke	can hurt the mouth, throat, and lungs
thermometers	 an example of using thermal expansion
ant colonies	 can be long-lived.
pneumothorax	 medical emergency
noble gases	 very unreactive
protozoa	 make long-term survival spores
neutrinos	 travel at the speed of light
neutrinos	 very difficult to detect
turbojet engines	 used on airplanes
tertiary sector	 the provision of services
bilbies	 an endangered species of australian marsupials.
clocks	control the timing of chess games
clocks	use different ways to measure time
pressure	lso related to density
nuclear meltdowns	can kill people from radiation poisoning
esters	 a very important functional group
esters	can also do many reactions
clitorises	range in size
lace	 made by knitting, crocheting and weaving
fingerspelling	 part of some sign languages
fingerspelling	 tool
whale meat	 used for food
stable atoms	have lower energy than unstable ones
seeds	germinate underground where there is no sunlight
redwood trees	can grow to be very large
spinach	has lots of dietary iron
nickel	can irritate skin
governments	have laws relating to sex
governments	still put seals on important documents
paint brushes	 used by painters of all sorts
different substances	form different types of crystals
different substances	have different heat capacities
coconut oil	 often in food and soaps
pollutants	have a poisonous effect on the body
crane flies	 look similar to large mosquitoes.
gaseous particles	 'bubbles'
sunburns	stay for days or weeks
kraits	 venomous
alpine skiing	 winter sport
alpine skiing	 played in the olympics
alpine skiing	 contest of speed
bengal tigers	have orange fur
blennies	 generally small fish.
frequency	 how often a behavior happens
child prodigies	 often musicians or mathematicians.
aircraft carriers	 airports at sea
programming languages	use or support regular expressions
programming languages	use punctuation just like a normal language
modern perfumes	contain synthesized odorants
rhetoric	 the mechanics of discourse
kelp	grows mostly in shallow marine waters
time	 measured in mya along the x-axis
dietitians	help promote good health through proper eating
prickles	 on the outside of stems
analytical chemistry	looks at which chemicals are in things
parliament	 where laws are made
glasses	contain a metal oxide fused with silica
resistance	 the restriction of current
puffers	live in brackish and fresh water
typical owls	vary greatly in size
lemon sharks	 usually eight to ten feet long
inductors	 used often in analog circuits
people	 allergic to penicillin
people	use ants for food, medicine and rituals
people	have ten fingers and ten toes
people	 allergic to fire ants
people	believe that life begins at conception
people	 addicted to sedatives
people	develop atherosclerosis faster than others
people	get headaches when they eat nitrites
people	keep hedgehogs as pets
people	keep skunks as pets
people	actually consider masturbation as a cardiovascular workout
people	keep fish as pets
people	 allergic to bananas
people	get acne during puberty
people	keep rats as a pet
people	study what people think about their body
people	say peace is the absence of war
people	 use drugs because they are addicted
people	study the human body
people	think sweat makes a person smell bad
people	have surgery to make their penises larger
people	dance to express their feelings and emotions
people	make art with wood
people	have two legs
people	have rabbits as pets
people	taxiderm their pets after they die
people	take prophylactic medicines for years
people	describe themselves as heterosexual
people	die every year due to drought
people	use coins as currency
people	lose their hearing later in life
people	like to watch other people play sports
people	suffer from emotional masochism
people	believe there is some form of afterlife
people	think depression is a different emotion
people	never grow wisdom teeth
people	believe in ghosts
people	put things inside other than clothes
people	kill themselves because they have been bullied
people	believe in 'guided evolution' or 'theistic evolution'
people	wear dust masks while vacuuming dusty rooms
people	use propofol for fun
people	pick their own locks as a hobby
people	 play handball, tennis, and other sports
people	like to sing melodies
mammalian embryos	have the same structures
occultism	 the study of occult
xylophones	have bars which are made of wood
volcanology	 sub-field of geology
predators	tend to have larger brains
alpine marmots	mature in their third year
evolution	mainly works by natural selection
magnets	can also repel other magnets
submarines	can hide under the water
light waves	can move through space
light waves	have 'crests' and 'troughs'
rage	 the strongest form of anger
pronouns	 special types of nouns
function words	 words that signify grammatical relations
indium	looks like zinc
prokaryotes	 unicellular
loons	eat fish like sunfish, perch, and bullheads
loons	 the state bird of minnesota
loons	communicate to each other through their sounds
tornadoes	begin as funnel clouds
hyphae	 usually syncytia
hyphae	look like threads, or rootlets
light interference	causes many colors to appear
boys	go through puberty in their teens
several diseases	 believed to result from misfolded proteins
female masturbation	can also protect against cervical infections
spadefoot toads	make crying sounds during a rainstorm
rough lumber	 the raw material for furniture making
fingernails	can grow into the skin
fingernails	grow one nanometer per second
cyclones	 common during the wet season
architecture	can be an art form
gardening	 related to farming
color of light	has a different wavelength
conduction	means heat or electricity traveling through something
tensile stress	 the opposite of compressive stress
warmer air	has lower thickness than cold air
machine code	 binary digits
machine code	 what assemble code
oats	have many uses in food
oats	 grown all over temperate places
flies	 have only the front pair of wings.
hedonism	 focused around pleasure
stainless steel	contains nickel
electrocyclic reactions	occur frequently in nature
punk rock	 style of music
female capuchins	have linear dominance hierarchies
funk rock	 fusion of funk and rock
right whales	 similar to bowhead whales, but smaller
sunlight	 powerful disinfectant
football	 the national sport in uganda
football	 popular sport in austria
football	 the world's most popular sport
football	 the most popular sport in zimbabwe
football	 the most popular sport in argentina
football	other popular sport in france
football	lso an increasingly popular sport
football	 the most popular sport in scotland
football	 the most popular sport in yemen
football	 the most popular sport in germany
football	 the most popular sport
maple sugar	 got from trunks of maple trees
external forces	 either surface forces or body forces
domestic cats	 found in shorthair and longhair breeds
logic gates	 electronic versions of boolean logic
logic gates	 digital components
white holes	 the exact opposites of black holes
azides	 explosive and very toxic
koalas	 mostly active at night
astronomy	 one of the oldest sciences
astronomy	 very similar to astrophysics
fashion models	 used to sell clothing or cosmetics
emission nebulae	make their own light
liquid particles	 called 'droplets'
electric blankets	 heated by electricity
wildfires	occur on every continent except antarctica
wildfires	 common and prevent trees from growing
globes	 maps of the earth
fruit bats	eat other things too
hibernation	 where the name dormouse comes from
bricks	 made of clay
electrical resistivity	lso inverse of electrical conductivity
taekwondo	develops force, speed, balance, flexibility, and stamina
length	 how long or short something is
length	lso a property of time
atmospheric pressure	decreases at high altitudes
atmospheric pressure	 measured in hpa
spectrophotometers	can also measure luminescence
sexual arousal	depends on hormones
discourse analysis	 related to text linguistics
resistors	used in electronics today are carbon resistors
gerbils	 diurnal, some are crepuscular
gerbils	 adapted to arid habitats
designers	 people who make things
architects	 people trained to design buildings
cratons	 subdivided geographically into geologic 'provinces'
pitch	 how humans hear different frequencies
telescopes	make objects look bigger, closer, brighter
girls	 experience a growth spurt during puberty
behaviorists	focus on relationships between stimuli and responses
luminosity	diminishes with distance from the centre
american pralines	have milk or cream
depersonalization	 sense of unreality about oneself
water polo	 team game
fashion	 way to express one's self
fashions	 a kind of nonverbal communication
fashion	 statement, a way of living
golden eagles	live in the scottish highlands
styrene molecules	join together to make a polystyrene molecule
colonial land	 land that belongs to the colony
coconut trees	grow along the coast of tahiti
swans	can also fly
swans	 mated for life
swans	 white
substances	 diamagnetic
geysers	 made in special geological conditions
geysers	 often near active volcanos
geysers	 usually near volcanic areas
hydrochloric acid	can cause bad burns
hydrochloric acid	makes milder burns
newborns	 much smaller than most other newborns
different chemicals	have different boiling points
wheat	has much zinc in it
wheat	 example of a soft commodity
weak thunderstorms	can produce lightning that starts a fire
identical twins	 natural clones
identical twins	 normal in a few species
bullying	happens to people of all ages
bullying	affects the process of consensus-building
bullying	 purposeful action
radio antennas	 in the shape of dishes
incest	 the ultimate form of inbreeding
bruises	change color over time
trouts	 fresh water fish
several fluorides	 found in the earth, though
primatology	 part of physical anthropology
radioactive decay	 calculated using differential equations
whole numbers	 integers
wind speed	increases strongly with altitude, while temperature decreases
seaweeds	occupy a wide range of ecological niches
islands	 smaller than continents
razor shells	have a fragile shell, with open ends
hydroelectric power	 means of conserving the energy
flea bites	 usually red bumps and they itch
ski boots	 connected to skis by ski bindings
ski boots	keep the feet of skiers warm
pot stills	 used for making alcohol like whisky
australian plants	burn easily
nut trees	grow near places that flood quite often
intellectual disability	 different from dementia
militarism	 related to militarization
floodplains	provide habitats for many plants and animals
agaves	grow mainly in mexico
warts	contain tissue that bleeds easily
sausages	 some of the oldest foods
field hockey	 official competition of the olympic games
goblins	 short, ugly, and green
millipedes	 poisonous
domes	normally have the shape of a hemisphere
curds	 used to make cheese
different religions	believe in different deities
different religions	teach different things about the afterlife
selenium deficiency	 rare
aquifers	can occur at various depths
common names	 used by people to describe something
constants	 used in maths and computer programming
bloodhounds	 usually a gentle and affectionate breed
sugar beets	 grown for sugar
tigons	have tiger fathers and lion mothers
major pests	 fruit flies, ants, and birds
croup	 caused by a virus infection
hernias	happen in the abdomen
people	 allergic to penicillin
people	use ants for food, medicine and rituals
people	have ten fingers and ten toes
people	 allergic to fire ants
people	believe that life begins at conception
people	 addicted to sedatives
people	develop atherosclerosis faster than others
people	get headaches when they eat nitrites
people	keep hedgehogs as pets
people	keep skunks as pets
people	actually consider masturbation as a cardiovascular workout
people	keep fish as pets
people	 allergic to bananas
people	get acne during puberty
people	keep rats as a pet
people	study what people think about their body
people	say peace is the absence of war
people	 use drugs because they are addicted
people	study the human body
people	think sweat makes a person smell bad
people	have surgery to make their penises larger
people	dance to express their feelings and emotions
people	make art with wood
people	have two legs
people	have rabbits as pets
people	taxiderm their pets after they die
people	take prophylactic medicines for years
people	describe themselves as heterosexual
people	die every year due to drought
people	use coins as currency
people	lose their hearing later in life
people	like to watch other people play sports
people	suffer from emotional masochism
people	believe there is some form of afterlife
people	think depression is a different emotion
people	never grow wisdom teeth
people	believe in ghosts
people	put things inside other than clothes
people	kill themselves because they have been bullied
people	believe in 'guided evolution' or 'theistic evolution'
people	wear dust masks while vacuuming dusty rooms
people	use propofol for fun
people	pick their own locks as a hobby
people	 play handball, tennis, and other sports
people	like to sing melodies
surfaces	 studied in geometry
sugarcane	grows in warm and tropical climates
librarians	help people find books and information
cathedrals	 the seat of bishops
cathedrals	have gargoyles
dingos	 similar to domestic dogs
dingos	 protected in national parks and reserves
astronomers	discover rings around uranus
countries	 have laws against child pornography.
countries	 have their own stamps.
countries	 have laws about prostitution.
countries	 have a stock exchange.
countries	 have a telephone network.
countries	 define supplements as food.
countries	 have 'libertarian political parties'.
countries	 divided into 'provinces'.
countries	 still have laws against atheism.
countries	 change capitals from time to time.
countries	 use chemicals that cause controversy.
countries	 very protective of their air space.
countries	 have different sizes for different liquids.
energy conservation	 used to burn less fossil fuel
ocean liners	 used for transportation
dry cells	 used in many electrical appliances
abalones	live all over the world
nitric acid	dissolves it, though, to make silver nitrate
bedroom furniture	 the objects in the bedroom
tree frogs	can change their colour for better camouflage
airplanes	 have wings
airplanes	 fixed wing
ableism	 prejudice towards disabled people
inhalation	can lead to death by asphyxiation
land	can have different types of soil
big balloons	 made from fabric
big balloons	 called aircraft
ethics	 part of the study of religion
hardwoods	grow slower than softwoods
blood donations	 kept liquid using citric acid
smoking	 dangerous to health
smoking	 'risk factor' for getting asthma
monarchs	 known for their long annual migration
mules	 hybrids
eyelashes	 keep sweat out of the eye
sugar gliders	 actually related to possums
gourds	 in the same family as squashes
drug abuse	 offense, at the federal level
gravestones	 kinds of stelae
ukuleles	normally have nylon strings or gut strings
cultures	have myths
cultures	 what make countries unique
slasher movies	 a subgenre of horror movies
euphoniums	 basically silver and brass in colour
passerines	have four toes on each foot
existentialism	 very different from many other 'philosophies'
