lipids	 fats, and waxes
chromates	can cause cancer
chromates	 generally yellow
mussels	live in lakes, rivers, and creeks
crows	make their nests in tall trees
crows	 resident birds
crows	eat a variety of food
bryozoans	can reproduce both sexually and asexually
bryozoans	 almost entirely colony-forming animals
zinc chloride	irritates skin and the respiratory tract
aromatic compounds	 important in industry
sumacs	 small trees
alloys	 metals with impurities
cholera	 acute intestinal illness
groundhogs	dig tunnels and live underground
permanganates	 toxic
permanganates	 the most toxic manganese compounds
permanganates	 purple-black
compound eyes	 different from simple eyes
iron	 present in meat
sea spiders	 found in all oceans
igneous rocks	 rocks formed from molten magma
igneous rocks	have a volcanic origin
igneous rock	occurs in two ways
gophers	can collect large hoards
gophers	 really ground squirrels or marmots
galagos	 omnivorous but primarily insectivorous
argonauts	 capable of changing their color
lupus	can be deadly
dendrites	take information to the cell body
inflammation	 common result of cytokine production
mental illnesses	develop during the life of a person
hamsters	have short legs
lampreys	 eel-like, scaleless animals
selenium sulfide	 poorly known chemical compound
grasshoppers	make good food for some
nerve cells	use electricity to transmit information
large scorpions	live in tropical forests
capybaras	eat plants, mostly grass
immunization	can happen from vaccination
jackdaws	 omnivorous and opportunistic
soap	 kind of cleaner
fusion	happens at the center of stars
hardwoods	grow slower than softwoods
semiconductors	 used to make photocells
dogs	 pack animals
dogs	 wolves modified by breeding
dogs	have four legs
dogs	 made of cheese
dogs	can serve people in many ways
pinecone fishes	 nocturnal
organisms	 made up of millions of cells
organisms	can either reproduce sexually or asexually
organisms	 motile
organisms	have two ways they can get behaviours
organisms	usually have five basic needs
honey bees	fan their wings to cool their colony
sea anemones	live in symbiosis with other animals
obesity	 the state of being very overweight
sparrows	 small birds
sparrows	eat seeds or small insects
elapids	 venomous and many are potentially deadly
morays	 carnivores
toxins	 the result of a biological process
petroleum	contains hydrocarbons
petroleum	has many thioethers in it as well
rain	 part of the water cycle
rain	 kind of precipitation
rain	 example of when drops fall
rain	falls in autumn and spring
rain	other force that works slowly
bull sharks	reach maturity depending on where they are
rubidium compounds	makes a red-violet color in a flame
bats	mostly live in caves or trees
bats	often live in caves
bats	 undertake seasonal migration between caves
bats	live almost everywhere
bats	fly with their hands
elephants	 have tusks
elephants	replace their teeth six times
elephants	 killed for their tusks
pronghorns	eat grass, but also leaves and herbs
venules	 the smallest veins
water vapor	 found in most of the air
water vapor	affects weather conditions
water vapor	 transparent
hornets	have a stinger
hornets	can alert the whole nest
sugar	can be different colours
moths	have antennae that look like feathers
moths	have larger scales on their wings
moths	 farmed
cranes	 tall birds with long legs
cranes	 omnivores
cranes	 an ancient type of wading bird
lemurs	communicate with a variety of hoots
bees	collect pollen from flowers
bees	make honey
bees	help plants
tapirs	 active at night
tapirs	live alone
tapirs	 swim very well
oil	 one of ecuador's natural resources
oil	lso a resource in some places
tigers	vary in size depending on their subspecies
metal oxides	 one group of extra chemicals
insect eggs	develop by nuclear division without cell membranes
sclerophyllous plants	occur in many parts of the world
flamingos	make their mounds completely out of mud
flamingos	 pink or red
hard drives	 used by computers to store data
tropical cyclones	form when warm, moist ocean air rises
tropical cyclones	create strong winds and heavy rains
earthquakes	 caused when a fault breaks suddenly
earthquakes	 measured using observations from seismometers
earthquakes	caused by subduction can lead to tsunamis
slate	 metamorphic mudstone or shale
ionizing radiation	can be electromagnetic radiation or subatomic particles
tickle spots	 feet, armpits and sides of stomach
visible light	 produced when the photon production increases
prokaryotic ribosomes	 different from eukaryotic ribosomes
myelodysplastic syndromes	affect the bone marrow stem cells
caffeine	 'stimulant' drug
caffeine	 in many drinks and foods
caffeine	 is a diuretic
caffeine	 has medicinal properties
caffeine	comes from other plants as well
caffeine	 problem for spiders
zinc compounds	can be corrosive in the stomach
light bulbs	convert electricity into light and heat
light bulbs	fit into a socket
copper	 used in electrical wiring
copper	 important in the human body
copper	 made pure by electrolyzing it
scyphozoans	have an internal jelly-like material
morphogenesis	gives rise to tissues, organs and anatomy
silver bromide	 used in film
saturated fats	 a kind of fat
saturated fats	 bad for people
carcinogens	come from both natural and man-made substances
watermelons	 oblong or spherical
bismuth telluride	 used in electronic thermometers
natural gas	 mixture
potassium chloride	 found as a mineral
potassium chloride	 toxic in very large amounts
potassium chloride	 heated very hot until it melts
birds	have feathers on their skin
birds	live on insects or on fish
birds	eat crane flies
birds	lose their feathers at certain times
birds	can 'glide' on air currents without flapping
birds	nest right on the ground
birds	can fly
birds	 eaten as food
birds	 the last surviving dinosaurs
birds	 mated for life, like married couples
birds	 territorial, especially in the nesting season
birds	make sounds to communicate
birds	 brown, green or grey
birds	migrate, such as geese and storks
birds	come in a huge range of colours
birds	can also 'sing'
birds	moult once every year
bioluminescence	 mainly a marine phenomenon
insect respiration	happens without lungs
pepper spray	 inflammatory agent
cadmium oxide	can be brown, red, or white
sea snakes	 able to breathe through their skin
erythropoietin	promotes the creation of red blood cells
cheetahs	have very little variation
asian elephants	eat grass, hay, twigs, bark and fruits
asian elephants	 different from african elephants
smaller arteries	 branch off from the aorta.
sea cucumbers	live on the floor of the ocean
sea cucumbers	 scavengers
lichen	 eaten by humans
lichens	cover the rocks
loggerheads	live in the seas around the world
loggerheads	 called 'hatchlings'
myrmecophiles	make food that the ants can eat
coral snakes	 shy, secretive animals, and are nocturnal
erosion	 geological process
erosion	can cause problems that affect humans
sedimentary rocks	 the most common rocks on earth
muskrats	live in burrows on the water banks
muskrats	often build dome-shaped houses in marshes
crab spiders	 hunters and ambushers
crab spiders	live in rainforests all over the world
lilies	 grow in europe, north america, and asia.
lilies	 make people think of life.
geckos	have no eyelids
peas	 an annual plant
peas	grow best in slightly acid, well-drained soils
rod cells	 very sensitive to light
poison dart	frogs secrete alkaloid toxins through their skin
light	enters the eyes through the cornea
light	exists in tiny packets called photons
light	can go long distances in a fiber
radium	 radioactive
terrestrial species	 adapted to survive extreme conditions
green toads	 green or yellow with black spots
bacteria	reproduce by asexual reproduction
bacteria	can use arsenate instead of phosphate, though
cloves	 used in cooking, whole or ground
cloves	 native to indonesia
oxides	 mostly of iron
computers	 electrical machines that run programs
computers	have some form of memory
computers	work in binary
computers	can be part of several different networks
mushrooms	have a stem and a cap
exothermic reactions	give out heat
dyotropic reactions	 important in organic chemistry
zebras	 horses, and live in africa
ferns	can grow large in moist places
smaller aldehydes	 more soluble in water
isotopes	 radioactive
grebes	can have long or short bills
grebes	have narrow wings
grebes	find it difficult to fly
grebes	 a medium or large size
grebes	do a mating ritual
selenium compounds	 colorless
wild boars	 omnivorous and easily adapt to changes
wild boars	 hunted to extinction in britain
fireflies	 glow as larvae.
wood	comes in many different kinds
nuclear reactors	 used to make electricity
nuclear reactors	 used to make electricity
reflection nebulae	reflect light from nearby stars
cockatoos	have black bills made of keratin
cockatoos	 a kind of parrot
sexual abuse	does emotional harm to children
prussian blue	 chemical compound
skin cancers	develop in the epidermis
monarch butterflies	 known for their long annual migration.
strychnine	causes muscular convulsions
strychnine	has few uses today
animals	have special excretory organs
animals	ejaculate when they reproduce sexually
animals	eat snails
animals	dig burrows to live in
animals	have some kind of sex organs
animals	 help move pollen between plants
animals	use venom to protect themselves
animals	have their breeding seasons in spring
animals	dig burrows
animals	 use teeth as a weapon
animals	have mate-selection courtship rituals
animals	keep their body in a stable condition
animals	reach wingspans of over a metre
animals	develop in separate stages
animals	can also see light
animals	can see light polarization
animals	get water by drinking
animals	have a biochemical 'clock' inside
animals	 dark on top and light underneath
animals	can also be overweight
animals	have only two or three chambers
animals	eat meerkats
animals	 indoors in tropical settings
animals	 can use music
animals	use more than one type of mimicry
animals	 consumers
animals	communicate extensively using such behaviours
animals	have much better noses than people
tarsiers	have huge eyes and long feet
tarsiers	give birth to single offspring
cucumbers	 fruits, and are often called vegetables
honey badgers	have the least specialised diet among mustelids
honey badgers	live alone in self-dug holes
amphiumas	have a long body
antidepressants	work to improve the mood
alcoholism	means addiction to alcohol
alcoholism	 condition with a social stigma
cyclic compounds	can be partly or completely conjugated
cyclic compounds	 very important
aphids	can travel far in the air
aphids	 found many places on earth
aphids	 most common in temperate zones
biochemistry	lso part of organic chemistry
rattlesnakes	sometimes hibernate in caves during cool weather
plastics	 insulators
rubidium chloride	 the most common rubidium compound
respondent behavior	 caused physiological reactions of the body
respondent behavior	 behavior that is involuntary
algae	 protists, if they are single-celled
flasks	 used to contain substances
vultures	have a bald head, with no feathers
vultures	symbolize death in literature
cantaloupes	 a source of polyphenol antioxidants
lepidopterans	go through 'complete metamorphosis'
pseudopods	can also capture prey by phagocytosis
flywheels	 used for storage of kinetic energy
milk	contains a chemical called lactose
milk	 emulsion
pure hydrogen	 very uncommon in the earth's atmosphere
bromide ions	can be toxic in large amounts
germanium	forms a large number of organometallic compounds
food additives	 used to improve food
zinc carbonate	makes zinc oxide when heated
fitness	varies in time and space
ringed seals	live throughout the arctic ocean
ringed seals	eat a wide variety of small prey
eyespots	can only distinguish light from dark
fuel cells	make electricity by combining oxygen and hydrogen
ant species	make homes where they always live
genetic variation	 increased by gene mutations
solar flares	occur in active regions around sunspots
siberian tigers	 the largest
carboxylic acids	 found a lot in food
dolphins	use echolocation to find their food
dolphins	have reasonable eyesight
dolphins	can hear a sound underwater
dolphins	 beautiful but fierce
humidity	affects the rate of evaporation
precession	 the wobble of the earth's axis
honeypot ants	belong to any of five genera
brine shrimp	take in food though their mouth
stoats	live in temperate, subarctic northern areas
stoats	live alone and are territorial
coffee	contains the drug caffeine
coffee	 the most important industry in colombia
dichromates	 red or orange
bullfinches	have glossy black wings and tail feathers
fermentation	 used when making dairy products
glia cells	keep the neurons safe and healthy
sea	snakes prey on fish, especially eels
seas	 part of an ocean
salts	containing the sulfite ion are called sulfites
bismuth	reacts with sulfur when molten as well
bat species	have eyes and are capable of sight
electromagnetic induction	causes electricity to flow through the wires
halophiles	 useful for cleaning up polluted environments
halophiles	 ferment salted fish
halophiles	play an important part in ecosystems
chloroform	 used as a solvent
electric current	 when electric charge flows
heat	has no mass
moderate halophiles	produce sugars outside the cell
dreams	 things that happen when people sleep
dreams	happen when people sleep
mountains	have forests of pine and fir
gray whales	 very agile swimmers
conifers	 wind-pollinated
hair	 made of keratin
pollination	 by wind
condors	 scavengers
nickel compounds	can be green, blue, gray, or black
ice pellets	 a type of frozen precipitation
ice pellets	 usually smaller than hailstones
eagles	 birds
vavilovian mimicry	 caused by unintentional selection by humans
figs	 pollinated by fig wasps
figs	grow in warm climates
leopard frogs	have circular spots
urethral syndrome	 related to urethritis
pi bonds	 usually weaker than sigma bonds
fanconi syndrome	 disorder affecting the kidneys
protists	take the form of single-celled flagellates
protists	 very small
integers	 rational numbers
badgers	 carnivorous
nuclear explosions	produce radiation and radioactive debris
butterflies	 have bright colours on their wings.
butterflies	 a natural monophyletic group.
butterflies	 go through complete metamorphosis.
butterflies	 have a very characteristic flying style.
butterfly	watching is a popular hobby
radioactive atoms	have unstable nuclei
hypertension	 more common in high-risk newborns
fungal hyphae	 often syncytia
hydrazoic acid	 very explosive
rhodium	 found in platinum ores
black mambas	eat small mammals like rodents and squirrels
reduction	 loss of oxygen
reduction	 the gain of electrons
reduction	 the opposite of oxidation
sodium nitrite	 common nitrite
food	 chewed by the teeth
foods	contain both unsaturated and saturated fats
food	contains nutrients
ants	produce a new generation each year
ants	exhibit a range of polymorphisms
ants	have colonies almost everywhere on planet earth
ants	collect honeydew from aphids
psychology	 field of medicine
snow	falls during blizzards or snowstorms
snow	comes in all different shapes and sizes
snow	 common in winter
snow	never falls in orlando
snow	does fall sometimes in north florida
metals	 purified using their iodides
metals	can dissolve in mercury
metals	have a very low electrical resistivity
metals	 gray in color
metals	produce flame colors
metals	 good at moving heat
metals	 gray or silver
antelope	 sexually dimorphic
psilocybin	changes certain things in the brain
nitro compounds	 very explosive
suicide	 when a person kills themselves
organic matter	contains carbon
lightning	 powerful electric current
lightning	lso fertilizer
lightning	lso an example of static discharge
point mutations	change a nucleotide single base pair
sex	creates variation in offspring
viruses	 much smaller than bacteria
viruses	 used widely in cell biology
palladium	has similar chemistry to platinum
compounds	break apart when they are ionized
cockroaches	 omnivores
gravity	 force
gravity	 the dominant interaction at cosmological distances
gravity	influences the passage of time
swifts	 small birds
lithium compounds	 used to make soap and grease
chemical reactions	produce energy in the form of heat
black holes	 perfectly spherical - like a ball
black holes	 responsible for quasars
resins	 soluble in both alcohol and turpentine
hawks	soar with wings raised slightly above horizontal
gravitational waves	 ripples in the curvature of spacetime
coral reefs	 fragile ecosystems
planarians	have both ovaries and testes
hallucinations	can affect all of a person's senses
hallucinations	 different from dreams
hallucinations	 different from illusions
pepper	can irritate the intestines
species	reproduce entirely by parthenogenesis
species	live in the ocean
species	 capable of changing sex
species	live in nests called 'forms'
species	live for as little as six months
species	live in subtropical and tropical regions
species	 single cells, some are multicellular
species	only live in very specific environments
species	have two sexes - male and female
species	live in forests or woodland habitats
species	live singly, others live in colonies
species	have venomous appendages on their sides
species	go feral easily and successfully
species	build roost nests
species	 wingless, or have reduced wings
species	 grown for their ornamental flowers
species	 kept as pets
species	 adapted to alpine climates
species	resist the cold rather well
tellurium trioxide	can come in two forms
bosons	 fundamental particles like the photon
calcium carbonate	 used as a calcium supplement
calcium carbonate	 used as a building material
calcium carbonate	 very abundant and usually mined
potoroos	live under thick bushes and shrubs
stars	use up the hydrogen at their core
stars	 made in nebulas
stars	have a magnetic field
stars	 a source of a gravity field
stars	can be billions of years old
stars	vary greatly in size
parrots	exhibit little or no sexual dimorphism
parrots	 intelligent birds
parrots	 vividly coloured, and some are multi-coloured
spontaneous abortions	occur in various mammals
juvenile arthritis	utoimmune
neutron stars	have very strong magnetic fields
neutron stars	rotate much faster than other stars
neutron stars	 very dense
alpine glaciers	form in mountain areas
hummingbirds	can see wavelengths into the near-ultraviolet
infectious diseases	have no treatments that work well
diseases	cause testicles to swell
diseases	 spread by infection
diseases	 caused by 'infection'
diseases	 more common in older people
diseases	 preventable through simple, non-medical methods
bull terriers	 very strong for their size
h	 hydrogen and o is oxygen
magpies	 large birds
solids	 generally denser than liquids
solids	can be mixtures also
musk deer	 mostly active at night
musk deer	 more primitive than true deer
warthogs	 found in moist and arid savannas
freckle formation	 triggered through exposure to sunlight
transcription	 the representation of the spoken word
death	 caused by evil spirits or spells
fish	live in the water
fish	come in many shapes and sizes
fish	 less than one centimeter long
fish	spend most of their time schooling
crops	 the foods that farmers grow
meteors	 only tiny specks of dust
brown algae	 gathered by humans for food
brown algae	grow on rocks at the seashore
lawrencium	 made from californium
thunder	 made when lightning strikes
ephedrine	 like amphetamine and methamphetamine
radio waves	 used to send and receive communications
radio waves	 used for many things today
petrology	 the scientific study of rocks
car batteries	 have a liquid electrolyte.
skinks	 carnivorous, which means they eat meat
skinks	 different from other lizards
boa constrictors	grow to a large size
psychological dependency	 dependency of the mind
potassium chromate	 very toxic
optical filters	act on light
sea lions	 fierce fighters, just like lions
diffraction	 occurs with matter such as electrons
batteries	 chemical cells.
batteries	 have chemical potential energy.
batteries	 have a paste electrolyte.
monocots	have one seed leaf
electricity	 sent on wires
electricity	can travel through a wire
electricity	 made in power stations
vaporization	 alternative to smoking
arsenic compounds	 used as poison gases
biology	 field of science
planetesimals	 created when dust particles collide
moats	 deep, wide ditches filled with water
poison gases	 used in industry as chemical reagents
manganese compounds	cause toxicity when ingested
digital photography	 photography done using a digital camera
chinchillas	live in colonies
fire salamanders	can have a very long life
smallpox	 caused by the related 'variola virus'
trees	 important for storing carbon
trees	grow shorter until they simply stop growing
trees	grow in some of the tundra
trees	 similar to people
trees	can vary very much
true owls	 found on every continent except antarctica
eels	have fewer fins than other fish
eels	hatch from eggs
eels	 predators
greenhouses	 special buildings where plants are grown
greenhouses	help to protect crops from frost
greenhouses	get hot during the day
greenhouses	 have glass or plastic walls
greenhouses	come in many different sizes
antibodies	 have a 'variable region' in their structure.
axons	 long, thin and tendril-like
axons	take information 'away from' the cell body
axons	 much like a highly developed dendrite
dental hygienists	help people keep their teeth clean
glycolysis	releases only a small amount of energy
toxic wastes	 usually liquid chemicals
alkenes	 liquid and spoil easily
alkenes	 similar to alkanes
idolatry	refers to the worship of idols
positive ions	 called 'cations'
benzodiazepines	 addictive
benzodiazepines	 very addictive
different tissues	have different kinds of cells
mouse deer	live in asia
mouse deer	 extremely nervous
lakes	never freeze to the bottom
lakes	tint by dispersion
rape	 form of sexual assault
rape	 medical emergency
insolation	affects temperature
different animals	have different numbers of chromosomes
indian elephants	eat mainly grass
halophilic microorganisms	 useful in biotechnology
african elephants	 larger and have bigger ears
african elephants	have a low place in their back
bamboos	have wood-like stems
glaciers	 blue in color
liquids	become solid by freezing
liquids	evaporate more quickly than others
sleep apnea	 treatable disease
sleep apnea	 risk factor of arteriosclerotic disease
narwhals	have two teeth in their upper jaw
pulmonary hypertension	makes the heart sound different
cats	 fairly independent animals
cheletropic reactions	 a subclass of cycloadditions
cheletropic reactions	confirm the conservation of molecular orbital symmetry
sodium azide	 very toxic
cheese	has calcium, protein, and phosphorus
cheese	 derived from milk
cheese	 made using milk
cheeses	 acidified by bacteria
cheese	 used in some dishes
wine	comes in different colors
wine	 made in many countries
wine	 popular drink in many countries
wine	 popular beverage in germany
illnesses	 caused by disease or disorders
iodine	now is extracted from seawater
organic chemistry	 basically the study of carbon compounds
polonium	 radioactive
polonium	 highly unstable, radioactive and toxic
red phosphorus	 used in matches and flares
red phosphorus	can burn but needs to be ignited
religions	have their own style of funeral ceremony
religions	have special buildings where people meet
religions	have sub-groups which are called denominations
religions	teach that homosexual sex is a sin
religions	make rules about human morals
religions	generally oppose abortion
religions	have a view on abortion
religion	 talks about the body
rays	 the main predator of bay scallops
castratos	 men without testicles
precious metals	 gold, silver, and platinum
naloxone	 used in emergency cases of overdose
plant shoots	have positive phototropism
stimulants	speed up the central nervous system
stimulants	have more side-effects than other drugs
stimulants	make it difficult to sleep
retraction	requires the contraction of two internal muscles
alcohols	 very weakly acidic
alcohol	 colorless, and also transparent
plant sap	 under pressure inside the plant
chopsticks	 used in many countries
fractional distillation	 how petroleum is refined
onions	 sometimes roasted whole
lineages	 parts of the tree of life
breast cancer	begins in the breast
coconut crabs	can climb trees
transition metals	have several general properties
shield volcanoes	 formed by lava that flows easily
shield volcanoes	 known to form on other planets
bubble gum	comes in many flavors
chemists	often use hydrogen peroxide in chemical reactions
chemists	get carbon dioxide from cooling air
chemists	study atomic orbital interactions
chemists	sort the mos by energy levels
chemists	therefore distinguish hydrogen chloride from hydrochloric acid
chemists	use hybridization theory mainly in organic chemistry
chemists	use the graph to calculate fundamental quantities
temperature	lso important in weather and climate
temperature	has an effect on density
tree roots	can destroy stones
nitrogen dioxide	 very toxic
ice hockey	 played on ice
giant pandas	 bears
giant pandas	eat bamboo
bumblebees	have a sting, as hive bees do
meat	have protein, some fat, and b vitamins
mosques	 places of worship
mosques	have prayer halls, domes, and minarets
mosques	have minarets
mosques	have minarets
mosques	 known for their islamic architecture
mosques	 famous works of architecture
lapwings	 shorebirds
pigs	can carry human influenza viruses
infertility	 deficient fertility
cognitive psychology	 the science which studies cognition
climate	regulates soil formation
climate	 different from weather
climates	can change after a long time
direct observation	 when behavior is watched and recorded
minarets	 tall towers
rainbows	show the entire spectrum of visible light
rainbows	 recognizable symbols of gay pride
rainbows	 a symbol of gay union
sign languages	 real languages
sign languages	can be similar to each other
sign languages	can influence each other
acetates	smell like acetic acid
prey animals	hide from predators
